[
  {
    "firstName": "Lina",
    "lastName": "Linster",
    "initials": "Li",
    "numberOfSeats": 5,
    "customDays": {
      "0": {
        "ignoreCompletely": false,
        "noWaitingAfternoon": false,
        "needsCar": false,
        "drivingSkip": false,
        "skipMorning": false,
        "skipAfternoon": false,
        "customStart": "",
        "customEnd": ""
      },
      "1": {
        "ignoreCompletely": false,
        "noWaitingAfternoon": false,
        "needsCar": false,
        "drivingSkip": false,
        "skipMorning": false,
        "skipAfternoon": false,
        "customStart": "",
        "customEnd": ""
      },
      "2": {
        "ignoreCompletely": false,
        "noWaitingAfternoon": false,
        "needsCar": false,
        "drivingSkip": false,
        "skipMorning": false,
        "skipAfternoon": false,
        "customStart": "",
        "customEnd": ""
      },
      "3": {
        "ignoreCompletely": false,
        "noWaitingAfternoon": false,
        "needsCar": false,
        "drivingSkip": false,
        "skipMorning": false,
        "skipAfternoon": false,
        "customStart": "",
        "customEnd": ""
      },
      "4": {
        "ignoreCompletely": false,
        "noWaitingAfternoon": false,
        "needsCar": false,
        "drivingSkip": false,
        "skipMorning": false,
        "skipAfternoon": false,
        "customStart": "",
        "customEnd": ""
      },
      "5": {
        "ignoreCompletely": false,
        "noWaitingAfternoon": false,
        "needsCar": false,
        "drivingSkip": false,
        "skipMorning": false,
        "skipAfternoon": false,
        "customStart": "",
        "customEnd": ""
      },
      "6": {
        "ignoreCompletely": false,
        "noWaitingAfternoon": false,
        "needsCar": false,
        "drivingSkip": false,
        "skipMorning": false,
        "skipAfternoon": false,
        "customStart": "",
        "customEnd": ""
      },
      "7": {
        "ignoreCompletely": false,
        "noWaitingAfternoon": false,
        "needsCar": false,
        "drivingSkip": false,
        "skipMorning": false,
        "skipAfternoon": false,
        "customStart": "",
        "customEnd": ""
      },
      "8": {
        "ignoreCompletely": false,
        "noWaitingAfternoon": false,
        "needsCar": false,
        "drivingSkip": false,
        "skipMorning": false,
        "skipAfternoon": false,
        "customStart": "",
        "customEnd": ""
      },
      "9": {
        "ignoreCompletely": false,
        "noWaitingAfternoon": false,
        "needsCar": false,
        "drivingSkip": false,
        "skipMorning": false,
        "skipAfternoon": false,
        "customStart": "",
        "customEnd": ""
      }
    }
  },
  {
    "firstName": "Tim",
    "lastName": "Kiel",
    "initials": "Ki",
    "numberOfSeats": 3,
    "customDays": {
      "0": {
        "ignoreCompletely": false,
        "noWaitingAfternoon": false,
        "needsCar": false,
        "drivingSkip": false,
        "skipMorning": false,
        "skipAfternoon": false,
        "customStart": "",
        "customEnd": ""
      },
      "1": {
        "ignoreCompletely": false,
        "noWaitingAfternoon": false,
        "needsCar": false,
        "drivingSkip": false,
        "skipMorning": false,
        "skipAfternoon": false,
        "customStart": "",
        "customEnd": ""
      },
      "2": {
        "ignoreCompletely": false,
        "noWaitingAfternoon": false,
        "needsCar": false,
        "drivingSkip": false,
        "skipMorning": false,
        "skipAfternoon": false,
        "customStart": "",
        "customEnd": ""
      },
      "3": {
        "ignoreCompletely": false,
        "noWaitingAfternoon": false,
        "needsCar": false,
        "drivingSkip": false,
        "skipMorning": false,
        "skipAfternoon": false,
        "customStart": "",
        "customEnd": ""
      },
      "4": {
        "ignoreCompletely": false,
        "noWaitingAfternoon": false,
        "needsCar": false,
        "drivingSkip": false,
        "skipMorning": false,
        "skipAfternoon": false,
        "customStart": "9:40",
        "customEnd": ""
      },
      "5": {
        "ignoreCompletely": false,
        "noWaitingAfternoon": false,
        "needsCar": false,
        "drivingSkip": false,
        "skipMorning": false,
        "skipAfternoon": false,
        "customStart": "",
        "customEnd": ""
      },
      "6": {
        "ignoreCompletely": false,
        "noWaitingAfternoon": false,
        "needsCar": false,
        "drivingSkip": false,
        "skipMorning": false,
        "skipAfternoon": false,
        "customStart": "",
        "customEnd": ""
      },
      "7": {
        "ignoreCompletely": false,
        "noWaitingAfternoon": false,
        "needsCar": false,
        "drivingSkip": false,
        "skipMorning": false,
        "skipAfternoon": false,
        "customStart": "",
        "customEnd": ""
      },
      "8": {
        "ignoreCompletely": false,
        "noWaitingAfternoon": false,
        "needsCar": false,
        "drivingSkip": false,
        "skipMorning": false,
        "skipAfternoon": false,
        "customStart": "",
        "customEnd": ""
      },
      "9": {
        "ignoreCompletely": false,
        "noWaitingAfternoon": false,
        "needsCar": false,
        "drivingSkip": false,
        "skipMorning": false,
        "skipAfternoon": false,
        "customStart": "",
        "customEnd": ""
      }
    }
  },
  {
    "firstName": "Rabea",
    "lastName": "Wirth",
    "initials": "Wr",
    "numberOfSeats": 5,
    "customDays": {
      "0": {
        "ignoreCompletely": false,
        "noWaitingAfternoon": false,
        "needsCar": false,
        "drivingSkip": false,
        "skipMorning": false,
        "skipAfternoon": false,
        "customStart": "",
        "customEnd": ""
      },
      "1": {
        "ignoreCompletely": false,
        "noWaitingAfternoon": false,
        "needsCar": false,
        "drivingSkip": false,
        "skipMorning": false,
        "skipAfternoon": false,
        "customStart": "",
        "customEnd": "11:10"
      },
      "2": {
        "ignoreCompletely": false,
        "noWaitingAfternoon": false,
        "needsCar": false,
        "drivingSkip": false,
        "skipMorning": false,
        "skipAfternoon": false,
        "customStart": "",
        "customEnd": ""
      },
      "3": {
        "ignoreCompletely": false,
        "noWaitingAfternoon": false,
        "needsCar": false,
        "drivingSkip": false,
        "skipMorning": false,
        "skipAfternoon": false,
        "customStart": "",
        "customEnd": ""
      },
      "4": {
        "ignoreCompletely": false,
        "noWaitingAfternoon": false,
        "needsCar": false,
        "drivingSkip": false,
        "skipMorning": false,
        "skipAfternoon": false,
        "customStart": "",
        "customEnd": ""
      },
      "5": {
        "ignoreCompletely": false,
        "noWaitingAfternoon": false,
        "needsCar": false,
        "drivingSkip": false,
        "skipMorning": false,
        "skipAfternoon": false,
        "customStart": "",
        "customEnd": ""
      },
      "6": {
        "ignoreCompletely": false,
        "noWaitingAfternoon": false,
        "needsCar": false,
        "drivingSkip": false,
        "skipMorning": false,
        "skipAfternoon": false,
        "customStart": "",
        "customEnd": "11:10"
      },
      "7": {
        "ignoreCompletely": false,
        "noWaitingAfternoon": false,
        "needsCar": false,
        "drivingSkip": false,
        "skipMorning": false,
        "skipAfternoon": false,
        "customStart": "",
        "customEnd": ""
      },
      "8": {
        "ignoreCompletely": false,
        "noWaitingAfternoon": false,
        "needsCar": false,
        "drivingSkip": false,
        "skipMorning": false,
        "skipAfternoon": false,
        "customStart": "",
        "customEnd": ""
      },
      "9": {
        "ignoreCompletely": false,
        "noWaitingAfternoon": false,
        "needsCar": false,
        "drivingSkip": false,
        "skipMorning": false,
        "skipAfternoon": false,
        "customStart": "",
        "customEnd": ""
      }
    }
  },
  {
    "firstName": "Svenja",
    "lastName": "Christoffers",
    "initials": "Ch",
    "numberOfSeats": 4,
    "customDays": {
      "0": {
        "ignoreCompletely": false,
        "noWaitingAfternoon": false,
        "needsCar": false,
        "drivingSkip": false,
        "skipMorning": false,
        "skipAfternoon": false,
        "customStart": "",
        "customEnd": ""
      },
      "1": {
        "ignoreCompletely": false,
        "noWaitingAfternoon": false,
        "needsCar": false,
        "drivingSkip": false,
        "skipMorning": false,
        "skipAfternoon": false,
        "customStart": "",
        "customEnd": ""
      },
      "2": {
        "ignoreCompletely": false,
        "noWaitingAfternoon": false,
        "needsCar": false,
        "drivingSkip": false,
        "skipMorning": false,
        "skipAfternoon": false,
        "customStart": "",
        "customEnd": ""
      },
      "3": {
        "ignoreCompletely": false,
        "noWaitingAfternoon": false,
        "needsCar": false,
        "drivingSkip": false,
        "skipMorning": false,
        "skipAfternoon": false,
        "customStart": "",
        "customEnd": ""
      },
      "4": {
        "ignoreCompletely": false,
        "noWaitingAfternoon": false,
        "needsCar": false,
        "drivingSkip": false,
        "skipMorning": false,
        "skipAfternoon": false,
        "customStart": "",
        "customEnd": ""
      },
      "5": {
        "ignoreCompletely": false,
        "noWaitingAfternoon": false,
        "needsCar": false,
        "drivingSkip": false,
        "skipMorning": false,
        "skipAfternoon": false,